{
  "id": "untheeleh_882",
  "excel_id": 882,
  "schema_version": "1.0",
  "name": "Unteroffizierschule des Heeres (Lehrgruppe A)",
  "kuerzel": null,
  "typ": "Bundesoberbehörde",
  "rechtsform": "Bundesbehörde",
  "ebene": "Bund",
  "sitz": "Berlin",
  "bundesland": "Berlin",
  "koordinaten": {
    "lat": null,
    "lon": null
  },
  "gruendungsjahr": null,
  "aufgeloest": false,
  "aufgeloest_jahr": null,
  "zustaendigkeit": "Militärische Ausbildungsstätte",
  "website": "https://www.bundeswehr.de/de/organisation/heer/organisation/ausbildungskommando/unteroffizierschule-des-heeres/",
  "rechtsgrundlage": null,
  "haushalt_mio_eur": null,
  "haushalt_jahr": null,
  "beschaeftigte": null,
  "beschaeftigte_jahr": null,
  "ministerium_id": "bmvg",
  "ressort": "Bundesministerium der Verteidigung (BMVg)",
  "klassifikation": "Militärische Ausbildungsstätte",
  "anmerkung": "Finanzierung über das Ressort Bundesministerium der Verteidigung (BMVg)",
  "beziehungen": [
    {
      "zu_id": "bmvg",
      "typ": "UNTERSTELLT",
      "richtung": "eingehend",
      "seit": null,
      "quelle": null
    }
  ],
  "quellen": [
    "https://www.bundeswehr.de/de/organisation/heer/organisation/ausbildungskommando/unteroffizierschule-des-heeres/"
  ],
  "recherche_datum": "2026-06-06",
  "recherche_agent_version": "2.0",
  "daten_qualitaet": {
    "vollstaendigkeit_prozent": 66.7,
    "zuletzt_verifiziert": "2026-06-06",
    "verifikation_noetig": false
  }
}