{
  "id": "frainsfürangint_14738",
  "excel_id": 14738,
  "schema_version": "1.0",
  "name": "Fraunhofer-Institut für Angewandte und Integrierte Sicherheit",
  "kuerzel": null,
  "typ": "Bundesanstalt",
  "rechtsform": "Bundesbehörde",
  "ebene": "Bund",
  "sitz": "Berlin",
  "bundesland": "Berlin",
  "koordinaten": {
    "lat": 52.5173885,
    "lon": 13.3951309
  },
  "gruendungsjahr": null,
  "aufgeloest": false,
  "aufgeloest_jahr": null,
  "zustaendigkeit": "Forschung",
  "website": "https://www.aisec.fraunhofer.de/",
  "rechtsgrundlage": null,
  "haushalt_mio_eur": 63.36,
  "haushalt_jahr": 2025,
  "beschaeftigte": null,
  "beschaeftigte_jahr": null,
  "ministerium_id": "bmbfsj",
  "ressort": "Bundesministerium für Bildung und Forschung (BMBF)",
  "klassifikation": "Forschung",
  "anmerkung": "Finanzierung über das Ressort Bundesministerium für Bildung und Forschung (BMBF)",
  "beziehungen": [
    {
      "zu_id": "bmbfsj",
      "typ": "UNTERSTELLT",
      "richtung": "eingehend",
      "seit": null,
      "quelle": null
    }
  ],
  "quellen": [
    "https://www.aisec.fraunhofer.de/"
  ],
  "recherche_datum": "2026-06-08",
  "recherche_agent_version": "2.0",
  "daten_qualitaet": {
    "vollstaendigkeit_prozent": 66.7,
    "zuletzt_verifiziert": "2026-06-06",
    "verifikation_noetig": false
  }
}