{
  "id": "insfürwis_612",
  "excel_id": 612,
  "schema_version": "1.0",
  "name": "Institut für Wissensmedien",
  "kuerzel": null,
  "typ": "Bundesoberbehörde",
  "rechtsform": "Bundesbehörde",
  "ebene": "Bund",
  "sitz": "Berlin",
  "bundesland": "Berlin",
  "koordinaten": {
    "lat": 52.5173885,
    "lon": 13.3951309
  },
  "gruendungsjahr": null,
  "aufgeloest": false,
  "aufgeloest_jahr": null,
  "zustaendigkeit": null,
  "website": "http://www.iwm-tuebingen.de/",
  "rechtsgrundlage": null,
  "haushalt_mio_eur": 2.01,
  "haushalt_jahr": 2025,
  "beschaeftigte": 200,
  "beschaeftigte_jahr": 2024,
  "ministerium_id": "bmi",
  "ressort": "Bundesministerium des Innern und für Heimat (BMI)",
  "klassifikation": null,
  "anmerkung": "Finanzierung über das Ressort Bundesministerium des Innern und für Heimat (BMI)",
  "beziehungen": [
    {
      "zu_id": "bmi",
      "typ": "UNTERSTELLT",
      "richtung": "eingehend",
      "seit": null,
      "quelle": null
    }
  ],
  "quellen": [
    "http://www.iwm-tuebingen.de/"
  ],
  "recherche_datum": "2026-06-08",
  "recherche_agent_version": "2.0",
  "daten_qualitaet": {
    "vollstaendigkeit_prozent": 66.7,
    "zuletzt_verifiziert": "2026-06-06",
    "verifikation_noetig": false
  }
}