{
  "id": "bunfürdatinf_305",
  "excel_id": 305,
  "schema_version": "1.0",
  "name": "Die Bundesbeauftragte für den Datenschutz und die Informationsfreiheit",
  "kuerzel": null,
  "typ": "Bundesoberbehörde",
  "rechtsform": "Bundesbehörde",
  "ebene": "Bund",
  "sitz": "Berlin",
  "bundesland": "Berlin",
  "koordinaten": {
    "lat": null,
    "lon": null
  },
  "gruendungsjahr": null,
  "aufgeloest": false,
  "aufgeloest_jahr": null,
  "zustaendigkeit": "Beauftragte für Datenschutz und Informationsfreiheit",
  "website": "https://www.service.bund.de",
  "rechtsgrundlage": null,
  "haushalt_mio_eur": 52.15,
  "haushalt_jahr": 2025,
  "beschaeftigte": null,
  "beschaeftigte_jahr": null,
  "ministerium_id": "bmjv",
  "ressort": "Bundesministerium der Justiz (BMJ)",
  "klassifikation": "Beauftragte für Datenschutz und Informationsfreiheit",
  "anmerkung": "Finanzierung über das Ressort Bundesministerium der Justiz (BMJ)",
  "beziehungen": [
    {
      "zu_id": "bmjv",
      "typ": "UNTERSTELLT",
      "richtung": "eingehend",
      "seit": null,
      "quelle": null
    }
  ],
  "quellen": [
    "https://www.service.bund.de"
  ],
  "recherche_datum": "2026-06-06",
  "recherche_agent_version": "2.0",
  "daten_qualitaet": {
    "vollstaendigkeit_prozent": 66.7,
    "zuletzt_verifiziert": "2026-06-06",
    "verifikation_noetig": false
  }
}