{
  "id": "bunkob_109",
  "excel_id": 109,
  "schema_version": "1.0",
  "name": "Bundespolizeidirektion Koblenz",
  "kuerzel": null,
  "typ": "Bundesoberbehörde",
  "rechtsform": "Dienststelle der Bundespolizei",
  "ebene": "Bund",
  "sitz": "Koblenz",
  "bundesland": "Rheinland-Pfalz",
  "koordinaten": {
    "lat": null,
    "lon": null
  },
  "gruendungsjahr": null,
  "aufgeloest": false,
  "aufgeloest_jahr": null,
  "zustaendigkeit": "Bundespolizei",
  "website": "https://www.bundespolizei.de",
  "rechtsgrundlage": null,
  "haushalt_mio_eur": 5074.74,
  "haushalt_jahr": 2025,
  "beschaeftigte": null,
  "beschaeftigte_jahr": null,
  "ministerium_id": "bmi",
  "ressort": "Bundesministerium des Innern und für Heimat (BMI)",
  "klassifikation": "Bundespolizei",
  "anmerkung": "Aggregiert unter Bundespolizei (BPOL)",
  "beziehungen": [
    {
      "zu_id": "bmi",
      "typ": "UNTERSTELLT",
      "richtung": "eingehend",
      "seit": null,
      "quelle": null
    }
  ],
  "quellen": [
    "https://www.bundespolizei.de"
  ],
  "recherche_datum": "2026-06-06",
  "recherche_agent_version": "2.0",
  "daten_qualitaet": {
    "vollstaendigkeit_prozent": 66.7,
    "zuletzt_verifiziert": "2026-06-06",
    "verifikation_noetig": false
  }
}