{
  "id": "jobwes_14221",
  "excel_id": 14221,
  "schema_version": "1.0",
  "name": "Jobcenter Wesermarsch",
  "kuerzel": null,
  "typ": "KdöR",
  "rechtsform": "Dienststelle der BA",
  "ebene": "Bund",
  "sitz": "Wesermarsch",
  "bundesland": "Niedersachsen",
  "koordinaten": {
    "lat": 53.3573141,
    "lon": 8.3454765
  },
  "gruendungsjahr": null,
  "aufgeloest": false,
  "aufgeloest_jahr": null,
  "zustaendigkeit": "Jobcenter",
  "website": "https://www.arbeitsagentur.de",
  "rechtsgrundlage": null,
  "haushalt_mio_eur": null,
  "haushalt_jahr": null,
  "beschaeftigte": null,
  "beschaeftigte_jahr": null,
  "ministerium_id": "bmas",
  "ressort": "Bundesministerium für Arbeit und Soziales (BMAS)",
  "klassifikation": "Jobcenter",
  "anmerkung": "Aggregiert unter Bundesagentur für Arbeit (BA)",
  "beziehungen": [
    {
      "zu_id": "bmas",
      "typ": "UNTERSTELLT",
      "richtung": "eingehend",
      "seit": null,
      "quelle": null
    }
  ],
  "quellen": [
    "https://www.arbeitsagentur.de"
  ],
  "recherche_datum": "2026-06-08",
  "recherche_agent_version": "2.0",
  "daten_qualitaet": {
    "vollstaendigkeit_prozent": 58.3,
    "zuletzt_verifiziert": "2026-06-06",
    "verifikation_noetig": false
  }
}