{
  "id": "bunfürpolbil_233",
  "excel_id": 233,
  "schema_version": "1.0",
  "name": "Bundeszentrale für politische Bildung",
  "kuerzel": null,
  "typ": "Bundesoberbehörde",
  "rechtsform": "Bundesbehörde",
  "ebene": "Bund",
  "sitz": "Berlin",
  "bundesland": "Berlin",
  "koordinaten": {
    "lat": 52.5173885,
    "lon": 13.3951309
  },
  "gruendungsjahr": null,
  "aufgeloest": false,
  "aufgeloest_jahr": null,
  "zustaendigkeit": "Politische Bildung",
  "website": "https://www.service.bund.de",
  "rechtsgrundlage": null,
  "haushalt_mio_eur": 100.1,
  "haushalt_jahr": 2025,
  "beschaeftigte": 300,
  "beschaeftigte_jahr": 2024,
  "ministerium_id": "bmi",
  "ressort": "Bundesministerium des Innern und für Heimat (BMI)",
  "klassifikation": "Politische Bildung",
  "anmerkung": "Finanzierung über das Ressort Bundesministerium des Innern und für Heimat (BMI)",
  "beziehungen": [
    {
      "zu_id": "bmi",
      "typ": "UNTERSTELLT",
      "richtung": "eingehend",
      "seit": null,
      "quelle": null
    }
  ],
  "quellen": [
    "https://www.service.bund.de"
  ],
  "recherche_datum": "2026-06-08",
  "recherche_agent_version": "2.0",
  "daten_qualitaet": {
    "vollstaendigkeit_prozent": 75.0,
    "zuletzt_verifiziert": "2026-06-06",
    "verifikation_noetig": false
  }
}