{
  "id": "beabunfürdeueis_50153",
  "excel_id": 50153,
  "schema_version": "1.0",
  "name": "Beauftragter der Bundesregierung für die deutschen Eisenbahnstrecken auf Schweizer Gebiet",
  "kuerzel": null,
  "typ": "Bundesoberbehörde",
  "rechtsform": "Bundesbehörde",
  "ebene": "Bund",
  "sitz": "Berlin",
  "bundesland": "Berlin",
  "koordinaten": {
    "lat": 52.5173885,
    "lon": 13.3951309
  },
  "gruendungsjahr": null,
  "aufgeloest": false,
  "aufgeloest_jahr": null,
  "zustaendigkeit": "Bahn",
  "website": "https://www.service.bund.de",
  "rechtsgrundlage": null,
  "haushalt_mio_eur": 177.32,
  "haushalt_jahr": 2025,
  "beschaeftigte": null,
  "beschaeftigte_jahr": null,
  "ministerium_id": "bmv",
  "ressort": "Bundesministerium für Digitales und Verkehr (BMDV)",
  "klassifikation": "Bahn",
  "anmerkung": "Finanzierung über das Ressort Bundesministerium für Digitales und Verkehr (BMDV)",
  "beziehungen": [
    {
      "zu_id": "bmv",
      "typ": "UNTERSTELLT",
      "richtung": "eingehend",
      "seit": null,
      "quelle": null
    }
  ],
  "quellen": [
    "https://www.service.bund.de"
  ],
  "recherche_datum": "2026-06-08",
  "recherche_agent_version": "2.0",
  "daten_qualitaet": {
    "vollstaendigkeit_prozent": 66.7,
    "zuletzt_verifiziert": "2026-06-06",
    "verifikation_noetig": false
  }
}