{
  "id": "baua",
  "excel_id": null,
  "schema_version": "1.0",
  "name": "Bundesanstalt für Arbeitsschutz und Arbeitsmedizin",
  "kuerzel": "BAuA",
  "typ": "Bundesanstalt",
  "rechtsform": "Bundesanstalt",
  "ebene": "Bund",
  "sitz": "Dortmund",
  "bundesland": "Nordrhein-Westfalen",
  "koordinaten": {
    "lat": 51.5142273,
    "lon": 7.4652789
  },
  "gruendungsjahr": 1996,
  "aufgeloest": false,
  "aufgeloest_jahr": null,
  "zustaendigkeit": "Arbeitsschutz, Arbeitsmedizin, Arbeitssicherheit, Gefahrstoffe, Produktsicherheit",
  "website": "https://www.baua.de",
  "rechtsgrundlage": "Gesetz über die Errichtung der Bundesanstalt für Arbeitsschutz und Arbeitsmedizin",
  "haushalt_mio_eur": 94.9,
  "haushalt_jahr": 2025,
  "beschaeftigte": 650,
  "beschaeftigte_jahr": 2024,
  "ministerium_id": "bmas",
  "ressort": null,
  "klassifikation": null,
  "anmerkung": null,
  "beziehungen": [
    {
      "zu_id": "bmas",
      "typ": "UNTERSTELLT",
      "richtung": "eingehend",
      "seit": 1996
    }
  ],
  "quellen": [
    "https://www.baua.de",
    "https://www.bundeshaushalt.de"
  ],
  "recherche_datum": "2026-06-08",
  "recherche_agent_version": "2.0",
  "daten_qualitaet": {
    "vollstaendigkeit_prozent": 100.0,
    "zuletzt_verifiziert": "2026-06-06",
    "verifikation_noetig": false
  }
}