{
  "id": "gembun_5135",
  "excel_id": 5135,
  "schema_version": "1.0",
  "name": "Gemeinsamer Bundesausschuss",
  "kuerzel": null,
  "typ": "KdöR",
  "rechtsform": "Bundesbehörde",
  "ebene": "Bund",
  "sitz": "Berlin",
  "bundesland": "Berlin",
  "koordinaten": {
    "lat": null,
    "lon": null
  },
  "gruendungsjahr": null,
  "aufgeloest": false,
  "aufgeloest_jahr": null,
  "zustaendigkeit": "Sozialversicherung",
  "website": "https://www.g-ba.de/",
  "rechtsgrundlage": null,
  "haushalt_mio_eur": null,
  "haushalt_jahr": null,
  "beschaeftigte": null,
  "beschaeftigte_jahr": null,
  "ministerium_id": "bmas",
  "ressort": "Bundesministerium für Arbeit und Soziales (BMAS)",
  "klassifikation": "Sozialversicherung",
  "anmerkung": "Finanzierung über das Ressort Bundesministerium für Arbeit und Soziales (BMAS)",
  "beziehungen": [
    {
      "zu_id": "bmas",
      "typ": "UNTERSTELLT",
      "richtung": "eingehend",
      "seit": null,
      "quelle": null
    }
  ],
  "quellen": [
    "https://www.g-ba.de/"
  ],
  "recherche_datum": "2026-06-06",
  "recherche_agent_version": "2.0",
  "daten_qualitaet": {
    "vollstaendigkeit_prozent": 66.7,
    "zuletzt_verifiziert": "2026-06-06",
    "verifikation_noetig": false
  }
}