{
  "id": "haudüs_546",
  "excel_id": 546,
  "schema_version": "1.0",
  "name": "Hauptzollamt Düsseldorf",
  "kuerzel": null,
  "typ": "Bundesoberbehörde",
  "rechtsform": "Dienststelle der Bundeszollverwaltung",
  "ebene": "Bund",
  "sitz": "Düsseldorf",
  "bundesland": "Nordrhein-Westfalen",
  "koordinaten": {
    "lat": 51.2254018,
    "lon": 6.7763137
  },
  "gruendungsjahr": null,
  "aufgeloest": false,
  "aufgeloest_jahr": null,
  "zustaendigkeit": "Hauptzollamt",
  "website": "https://www.zoll.de",
  "rechtsgrundlage": null,
  "haushalt_mio_eur": null,
  "haushalt_jahr": null,
  "beschaeftigte": null,
  "beschaeftigte_jahr": null,
  "ministerium_id": "bmf",
  "ressort": "Bundesministerium der Finanzen (BMF)",
  "klassifikation": "Hauptzollamt",
  "anmerkung": "Aggregiert unter Generalzolldirektion (GZD)",
  "beziehungen": [
    {
      "zu_id": "bmf",
      "typ": "UNTERSTELLT",
      "richtung": "eingehend",
      "seit": null,
      "quelle": null
    }
  ],
  "quellen": [
    "https://www.zoll.de"
  ],
  "recherche_datum": "2026-06-08",
  "recherche_agent_version": "2.0",
  "daten_qualitaet": {
    "vollstaendigkeit_prozent": 66.7,
    "zuletzt_verifiziert": "2026-06-06",
    "verifikation_noetig": false
  }
}