{
  "id": "bet_7774",
  "excel_id": 7774,
  "schema_version": "1.0",
  "name": "R+V Betriebskrankenkasse",
  "kuerzel": null,
  "typ": "KdöR",
  "rechtsform": "Bundesbehörde",
  "ebene": "Bund",
  "sitz": "Berlin",
  "bundesland": "Berlin",
  "koordinaten": {
    "lat": null,
    "lon": null
  },
  "gruendungsjahr": null,
  "aufgeloest": false,
  "aufgeloest_jahr": null,
  "zustaendigkeit": "Krankenkasse",
  "website": "https://www.ruv-bkk.de/",
  "rechtsgrundlage": null,
  "haushalt_mio_eur": 596.0,
  "haushalt_jahr": 2025,
  "beschaeftigte": 320,
  "beschaeftigte_jahr": 2024,
  "ministerium_id": "bmg",
  "ressort": "Bundesministerium für Gesundheit (BMG)",
  "klassifikation": "Krankenkasse",
  "anmerkung": "Finanzierung über das Ressort Bundesministerium für Gesundheit (BMG)",
  "beziehungen": [
    {
      "zu_id": "bmg",
      "typ": "UNTERSTELLT",
      "richtung": "eingehend",
      "seit": null,
      "quelle": null
    }
  ],
  "quellen": [
    "https://www.ruv-bkk.de/"
  ],
  "recherche_datum": "2026-06-06",
  "recherche_agent_version": "2.0",
  "daten_qualitaet": {
    "vollstaendigkeit_prozent": 75.0,
    "zuletzt_verifiziert": "2026-06-06",
    "verifikation_noetig": false
  }
}